None	1	0	385	10	294	.wa-lottery-v2-textbox{word-break:normal;word-wrap:normal;position:relative;-webkit-appearance:none;appearance:none;padding-left:12px;height:36x;vertical-align:middle;line-height:36px;font-size:14px;color:#333;background-color:transparent;border:1pxsolid#eee;border-color:#ddd#eee#eee#ddd;border-radius:0;overflow:hidden;outline:none;padding-right:30px;}.wa-lottery-v2-optiontexttag{background-color:#a8bdde;position:relative;top:-1px;left:5px;}.wa-lottery-v2-optiontext-hide{display:none!important;}.wa-lottery-v2-rednum{background-color:#fff;display:inline-block;width:29px;height:29px;border-radius:50%;text-align:center;line-height:29px;border:2pxsolid#f54646;color:#f54646;}.wa-lottery-v2-bluenum{background-color:#fff;display:inline-block;width:29px;height:29px;border-radius:50%;text-align:center;line-height:29px;border:2pxsolid#3ea1f4;color:#3ea1f4;}@media(max-width:374px){.wa-lottery-v2-rednum,.wa-lottery-v2-bluenum{width:23px;height:23px;line-height:23px;vertical-align:middle;}.wa-lottery-v2-tip{vertical-align:middle;}}.wa-lottery-v2-numsspan:last-child{margin-right:0px;}.wa-lottery-v2-opentime,.wa-lottery-v2-bonus{font-size:14px;}.wa-lottery-v2-popup{display:none;}.wa-lottery-v2-btn{border-color:#a2c7fa;background-color:#ecf6ff;height:36px;color:#00c;line-height:36px;font-size:14px;}.wa-lottery-v2-red{color:#f54646;}.wa-lottery-v2-inputdown{position:absolute;top:0;right:0px;padding:010px05px;background-color:#fff;}.wa-lottery-v2-padt8{padding-top:8px;}.wa-lottery-v2-padb8{padding-bottom:8px;}.wa-lottery-v2-tip{display:inline-block;padding-top:8px;}.wa-lottery-v2-blk{display:inline-block;}.wa-lottery-v2-k8{white-space:nowrap;}.wa-lottery-v2-13{font-size:13px;}.wa-lottery-v2-kp-card{width:26px;height:26px;border:1pxsolid#999;background:url(//m.baidu.com/static/ala/lottery_v2/puke.png)no-repeat00;background-size:104px26px;display:inline-block;}.wa-lottery-v2-kp-heitao{background-position:00;}.wa-lottery-v2-kp-hongtao{background-position:-26px0;}.wa-lottery-v2-kp-meihua{background-position:-52px0;}.wa-lottery-v2-kp-fangkuai{background-position:-78px0;}.wa-lottery-v2-kp-num{vertical-align:middle;}.wa-lottery-v2-optiontext{white-space:nowrap;}div[id=wiseui-dialog-lottery-v2].wiseui_dialog_body{max-height:258px;}div[id=wiseui-dialog-lottery-v2]ul{margin:-10px;}div[id=wiseui-dialog-lottery-v2]ulli{text-align:left;position:relative;border-bottom:1pxsolid#f1f1f1;line-height:42px;height:42px;list-style:none;display:block;font-size:17px;padding-left:25px;padding-right:30px;color:#666;}div[id=wiseui-dialog-lottery-v2]ulli.selected{background-color:#fafafa;font-weight:bold;}div[id=wiseui-dialog-lottery-v2]ulli.wa-lottery-v2-inputdown{z-index:-1;top:auto;}/*div[id=wiseui-dialog-lottery-v2]ullispan{position:absolute;right:15px;}div[id=wiseui-dialog-lottery-v2]ullispan:before{content:'\e65f';color:#c8c8c8;font-size:10px;}*/.wa-lottery-v2-nodata{padding:20px0;text-align:center;}大乐透16109期_开奖结果_百度彩票第16109期2016-09-1720:30新03252831341112一等奖项：2注，每注10,000,000元二等奖项：50注，每注198,739元奖池奖金：3,466,514,047元玩法说明下期预测历史开奖16109(09-17周六开奖)16108(09-14周三开奖)16107(09-12周一开奖)16106(09-10周六开奖)16105(09-07周三开奖)16104(09-05周一开奖)16103(09-03周六开奖)16102(08-31周三开奖)16101(08-29周一开奖)16100(08-27周六开奖)16099(08-24周三开奖)16098(08-22周一开奖)16097(08-20周六开奖)16096(08-17周三开奖)16095(08-15周一开奖)16094(08-13周六开奖)16093(08-10周三开奖)16092(08-08周一开奖)16091(08-06周六开奖)16090(08-03周三开奖)www.lecai.com为您推荐：大乐透预测号码下一期大乐透预测最准十专家大乐透中奖规则双色球预测最准确大乐透走势图表复式投注追号彩票倍投
2	2	0	385	304	448	大乐透走势图,超级大乐透基本走势图,彩票走势图-网易...网易彩票平台体彩超级大乐透基本走势图包括前区开奖号码分布和后区开奖号码分布、号码出现总次数、号码遗漏、...trend.caipiao.163.com137条评价为您推荐：大乐透投注技巧双色球预测最准确大乐透中奖规则彩票倍投追号排列三黑龙江11选5彩票哥
None	3	0	385	458	705	大乐透的相关消息.wa-we-realtime-list-first{margin-top:3px;}.wa-we-realtime-abstract{margin-bottom:0;}.wa-we-realtime-bottom{margin-bottom:6px;}大乐透大奖扎堆河南欢喜功夫熊猫领取1000万10小时前 搜狐彩票[唐万顺]大乐透16110期分析:前区14码大底10小时前 网易彩票大乐透爆2注千万头奖奖池34.66亿17小时前 网易新闻为您推荐：大乐透预测号码下一期双色球预测最准确大乐透今日预测大乐透中奖规则大乐透走势图表大乐透投注技巧追号复式投注
None	4	0	385	715	937	大乐透_相关术语.wa-sigma-celebrity-rela-scroller{white-space:nowrap;}.wa-sigma-celebrity-rela-entity{display:inline-block;vertical-align:top;}.wa-sigma-celebrity-rela-entity:first-child{padding-left:0px;}.wa-sigma-celebrity-rela-name{color:#00a;text-align:center;line-height:22px;white-space:pre-line;word-break:normal;word-wrap:normal;margin-bottom:2px;}.wa-sigma-celebrity-rela-reason{text-align:center;white-space:pre-line;word-break:normal;word-wrap:normal;font-size:13px;line-height:19px;margin-bottom:0;}.wa-sigma-celebrity-rela-comment{position:relative;height:21px;margin:0auto;width:60px;}.wa-sigma-celebrity-rela-comment.c-icon{display:inline-block;width:12px;text-align:center;}.wa-sigma-celebrity-rela-comment-graystar{position:absolute;color:#eee;}.wa-sigma-celebrity-rela-comment-redstar{position:absolute;color:#ff0000;white-space:nowrap;overflow:hidden;}.wa-sigma-celebrity-rela-nowrap{white-space:nowrap;}.wa-sigma-celebrity-coverWrap{position:relative;}.wa-sigma-celebrity-cover{width:100%;height:100%;font-size:25px;color:#fff;position:absolute;left:0;top:0;right:0;bottom:0;z-index:2;text-align:center;background:rgba(0,0,0,0.5);overflow:hidden;display:block;}.wa-sigma-celebrity-coverp{font-size:13px;text-align:center;line-height:12px;}.wa-sigma-celebrity-cover-inner{text-align:center;vertical-align:middle;position:absolute;top:50%;left:50%;height:44px;margin-top:-22px;margin-left:-26px;}@mediascreenand(max-width:335px){.wa-sigma-celebrity-rela-comment{width:50px;}.wa-sigma-celebrity-rela-comment.c-icon{width:10px;}}复式投注提高彩票中奖率的投注追号连续购买固定彩票号码黑龙江11选5快开型彩票玩法彩票倍投一组复式号码中国福利彩票3D游戏以3位自然数为投注号胆拖主次分明的选号方法双色球复式双色球投注方法012路3d彩票的术语
5	5	0	385	947	1091	超级大乐透基本走势图—彩票大赢家(www.cpdyj.com)彩票大赢家为彩民提供超级大乐透走势图,其中包括超级大乐透基本走势图,尾号,后区综合走势图,跨度走势图,前区...zst.cpdyj.com71条评价为您推荐：大乐透预测号码下一期大乐透中奖规则双色球预测最准确大乐透预测最准十专家排列五走势图3d走势图七星彩走势图排列三走势图
None	6	0	385	1101	1288	.wa-zhidaonormal-fxhl{line-height:normal;}大乐透的真实性_百度知道39个回答-提问时间：2013年08月18日问题描述：大乐透是不是真的?听有人幕后操作[最佳答案]不光大乐透,所有彩票均为人为控制中奖!就说大乐透,以前是21:55分开奖,后来改为21:00开奖,但是...zhidao.baidu.com评价为您推荐：5.7亿巨奖得主死了买彩票中奖的前兆大乐透预测号码下一期双色球预测最准确双色球内部员工揭秘大乐透今日预测大乐透中奖规则大乐透投注技巧
None	7	0	385	1298	1442	超级大乐透大乐透走势图大乐透开奖大乐透预测-搜狐超级大乐透,体彩大乐透,中国体育彩票大乐透,大乐透,中国体育彩票,大乐透开奖,大乐透走势图,大乐透预测,大乐透开奖...caipiao.sohu.com评价为您推荐：大乐透历史开奖号码大乐透开奖结果规则双色球走势图体彩大乐透中奖规则复式投注双色球开奖结果查询彩票倍投彩票哥
None	8	0	385	1452	1574	【大乐透走势图】体彩超级大乐透走势图_大..._新浪爱彩高频彩走势图大全|福彩双色球走势图带坐标|福彩双色球走势图带坐标|大乐透走势图带坐标|十一运夺...zst.aicai.com340条评价为您推荐：大乐透预测大乐透中奖规则双色球走势图双色球预测最准确七乐彩走势图排列三走势图七星彩走势图排列五走势图
None	9	0	385	1584	1728	大乐透开奖结果_大乐透开奖结果查询_大乐透开奖结果...大乐透开奖结果提供体彩大乐透开奖结果查询,包括大乐透开奖结果今天、开奖号码等内容,查询大乐透开奖结果就上开奖...m.55128.cn评价为您推荐：大乐透开奖结果查询走试图大乐透预测号码下一期大乐透走势图大乐透开奖结果规则大乐透预测最准十专家大乐透玩法大乐透历史开奖号码复式投注
None	10	None	None	None	None	大乐透_百度百科.wa-bk-polysemy-hide{display:none;}.wa-bk-polysemy-greeting{height:38px;border:solid1px#ddd;border-bottom-width:0;overflow:hidden;-webkit-user-select:none;user-select:none;}.wa-bk-polysemy-greetingaudio{display:none;height:0;}.wa-bk-polysemy-greetingp{display:none;text-align:center;line-height:2.7;height:38px;}.wa-bk-polysemy-greetingpimg{position:relative;top:1px;width:11px;height:14px;}.wa-bk-polysemy-greetingpi{display:inline-block;position:relative;top:2px;width:11px;height:14px;}.wa-bk-polysemy-progress-bar{height:2px;background-color:#ddd;}.wa-bk-polysemy-progress-bar-occupied{width:0;height:100%;background-color:#008bf8;}.transition-linear{-webkit-transition:width.25slinear;transition:width.25slinear;}.wa-bk-polysemy-speaker-play{background:url(//m.baidu.com/se/static/aladdin/bk_polysemy/loudspeaker_51cd437.png)no-repeat;background-size:44px14px;-webkit-animation-name:speaker;-webkit-animation-duration:1.2s;-webkit-animation-timing-function:steps(3);-webkit-animation-iteration-count:infinite;animation-name:speaker;animation-duration:1.2s;animation-timing-function:steps(3);animation-iteration-count:infinite;}.wa-bk-polysemy-speaker-default{background:url(//m.baidu.com/se/static/aladdin/bk_polysemy/loudspeaker_04_4729721.png)no-repeat;background-size:11px14px;}@-webkit-keyframesspeaker{0%{background-position:00;}42%{background-position:-33px0;}100%{background-position:00;}}@keyframesspeaker{0%{background-position:00;}42%{background-position:-33px0;}100%{background-position:00;}}.wa-bk-polysemy-clamp{max-height:88px;line-height:22px;}简介：大乐透——“35选5加12选2”是国家体育总局体彩中心为适应市场发展需要，丰富体育彩票的市场结构，经过慎重研究和广泛的市场调研，于2007年5月28日向全国推出的一种全新大盘彩票玩法。自第14052期(2014年5月5日20:10开售)起，变更中国体育彩票超级大乐透游戏规则。玩法介绍“35选5加12选2”玩法属于双区选号大乐透，玩法简单易懂，彩民们在购买“35选5加12选2”时，可以从01-35共35个号码中，选取5个号码为前区号码，并从01-12共12个号码中选取2个号码为后区号码，组合为一注进行单式投注。超级大乐透“35选5加12选2”玩法的奖组为21425712个，奖级设置为6个奖级，一等奖中奖概率为21425712分之一，总中奖率为6.16%。超级大乐透“35选5加12选2”投注方式多样，除单式投注外，也可以进行胆拖投注、复式投注，每一基本投注金额为2元人民币。超级大乐透“
