1	1	0	385	7	178	微信提现到挂失的银行卡怎么办_搜狗问问1个回答   提问时间：2016年05月08日最佳答案银行卡挂失的话,提现会失败,款项会自动退回,不过这个过程可能需要1到2天时间,请耐心等待搜搜-wenwen.m.sogou.com
2	2	None	None	None	None	qq提现到挂失的银行卡中显示成功了怎么办_百度知道2个回答   最佳答案你好,显示的不过是提现成功罢了,还需要等待客服处理到账的.然而你银行卡是挂失状态的.客服处理时.就会处理失败.到时候会退钱给你的,希望我的回答对你有帮助.望采纳.展开全部百度-wapiknow.baidu.com
3	3	None	None	None	None	微信提现,不小心提现到了挂失的银行卡里了怎么办,谁遇到过这种问...1个回答   最佳答案挂失的银行卡,就是该银行卡不在自己手里,但是还是有储蓄功能的.时间很久了显示到账的话,只能去银行补办该挂失的银行卡,或者注销该银行展开全部百度-wapiknow.baidu.com
None	4	19	366	647	768	93%的人还搜了提现到挂失银行卡银行卡挂失微信提现吗银行卡挂失卡里的钱提现是提到银行卡里吗
None	5	0	385	774	983	微信提现到已挂失的银行卡里怎么办,微信客服-搜狐社区›微信提现到已挂失的银行卡里怎么办,微信客服010一62507654微信零钱提现到已挂失的银行卡里怎么办,客服电话-搜狐社区支付宝提现到已挂失的银行卡里怎么办,客服电话-搜狐社区搜狐体育-club.sports.sohu.com
None	6	0	385	990	1133	微信钱包提现到已挂失的银行卡里怎么办,客服电话-搜狐社区›微信钱包提现到已挂失的银行卡里怎么办,客服电话...010一62507654搜狐IT-club.it.sohu.com
None	7	0	1	366	367	
None	8	0	1	366	367	
None	9	0	385	1351	1494	微信红包提现到已挂失的银行卡里怎么办,客服电话-搜狐社区›微信红包提现到已挂失的银行卡里怎么办,客服电话...010一62507654搜狐IT-club.it.sohu.com
None	10	0	385	1500	1617	支付宝提现的银行卡挂失了怎么办来源,作者:支付宝提现的银行卡挂失了怎么办第三方支付(6881人参与)如题:支付宝提现的银行卡挂失了...www.gongniu.cn
None	11	0	385	1623	1816	我中午给银行卡挂失了刚才不小心把微信里面的钱提现到挂失卡里面了...2个回答   提问时间：2016年08月19日最佳答案提现的钱会正常到账的,被挂失的银行卡不可以向外转账或者支取,但是可以接收转账,补办新卡后旧卡里的余额会全部转到新卡里.百度-wapiknow.baidu.com
None	12	0	385	1823	1972	微信支付提现到了已挂失的银行卡中怎么办?钱会不会不见了?_百度...7个回答   提问时间：2015年10月01日最佳答案放心吧,不会的挂失了只是娶不了钱.百度-wapiknow.baidu.com
None	13	0	385	1979	2216	微信理财通提现银行卡丢失不用怎么办_百度经验1我想相信使用微信理财通的朋友绝大...2如果觉得转到其它的银行卡内不方便...3这两步哪个方法觉得有用用哪个?接...查看更多
None	14	0	385	2223	2223	猜你关注:长城卡本页面有商业推广信息，请注意可能产生的风险。
