1	1	0	385	10	218	拔罐后皮肤变黑怎么快速恢复正常_百度知道一般拔罐后皮肤紫黑,这和局部受寒,及肌肉有慢性损伤有关,拔罐可以使淤血状态改善。所以,拔罐后...拔罐后皮肤全是黑紫色怎么回事1个回答拔罐后皮肤颜色有黑色园点,是什么原因2个回答百度知道
2	2	0	385	228	371	请问拔罐后皮肤变黑是什么原因?是不是生..._百度作业帮1个回答-提问时间：2014年09月17日[最佳答案]拔火罐留下的罐斑以及颜色的意义常见的罐斑有潮红、紫红或紫黑色淤斑,小点状紫红色的疹子,同时还...www.zybang.com2588条评价为您推荐：拔罐后皮肤颜色鉴别拔罐后皮肤黑色是怎么回事拔火罐颜色分析图拔罐的好处和坏处拔罐后多久才可以冼热水澡拔罐能治病吗拔火罐皮肤黑紫
3	3	0	385	381	503	拔罐之后皮肤出现黑紫是什么?拔罐之后的肤色表..._搜狐首先我们需要弄清楚,拔罐之后皮肤出现的颜色可以反映出我们的身体状况。例如皮肤的颜色呈现黑紫,...m.sohu.com60条评价为您推荐：拔罐肾在那个部位肾不好有哪些症状拔火罐的好处和坏处供血不足的症状
4	4	0	385	513	657	拔罐后黑紫是怎么回事_拔罐_中医_99健康网2015年8月13日 - 拔罐后,不同的人皮肤上会有不同的反应,那么,拔罐后黑紫是怎么回事?如何从拔罐后的皮肤颜色看健康?m.99.com.cn508条评价为您推荐：拔火罐颜色分析图拔罐穴位图拔罐多久拔一次抜罐后紫黑色什么原因拔罐的坏处拔罐后皮肤颜色鉴别拔完火罐多久可以洗澡拔完火罐后背呈紫黑
5	5	0	385	667	808	拔罐后皮肤颜色鉴别反映身体状况_中医养生_养生之道网2015年7月8日 - 月经量少是什么原因拔罐后皮肤颜色鉴别眼皮跳是什么原因...皮肤白斑的常见并发症女子颜面黑变病引发什么疾病...m.ys137.com评价为您推荐：拔罐后皮肤颜色鉴别图拔罐颜色深浅反应身体状况拔罐发紫拔火罐拔罐后紫黑怎么办拔罐的好处和坏处关元穴关元
None	6	0	385	818	962	你好,拔罐后,皮肤很黑,是什么现状_39健康网问医生wap版2015年10月9日 - 病情描述:你好,拔罐后,皮肤很黑,是什么现状补充说明:没有标签:瘀血毛细血管你好,拔罐后,皮肤很...wapask.39.net875条评价
None	7	0	385	972	1116	拔火罐后为什么颜色会很黑_百度拇指医生2013年8月4日 - 人体在火罐负压吸拔的时候,皮肤表面有大量气泡溢出,...我先把拔罐后颜色和症状的对应关系告诉你---黑主毒...muzhi.baidu.com6508条评价为您推荐：拔火罐颜色分析图拔罐多久拔一次拔完火罐多久可以洗澡拔罐后皮肤颜色鉴别拔火罐可以去湿气吗拔火罐穴位图解拔血罐拔罐穴位图
None	8	0	385	1126	1270	拔罐拔的皮肤颜色成黑色的了是什么情况?_飞华健康问答2014年9月12日 - 拔罐拔的皮肤颜色成黑色的了是什么情况?病情描述:(男,20岁)拔罐后肩膀"大椎"还有腰上怎么都是紫的...m.fh21.com.cn367条评价
None	9	0	385	1280	1424	拔罐后,后背全都是黑色的,怎么回事?_寻医..._寻医问药网2015年4月23日 - 病情分析:拔罐后皮肤紫黑,这和局部受寒,及肌肉有慢性损伤有关,拔罐可以使淤血状态改善。意见建议:所以,拔...3g.club.xywy.com630条评价为您推荐：拔罐后注意事项拔火罐颜色分析图背部拔罐位置示意图正确背部拔火罐位置图拔罐多久拔一次后背拔罐示意图背部拔罐的颜色解说拔罐后皮肤颜色鉴别
None	10	0	385	1434	1575	拔罐后皮肤颜色鉴别,拔罐后黑紫,拔火罐颜色-乐哈健康网2014年10月29日 - 拔罐后皮肤出现不同的颜色反映了被拔罐者不同的健康状况,那么拔罐后出现的不同颜色分别反映了怎样的健康状况...m.leha.com评价为您推荐：拔火罐颜色分析图刮痧后背部颜色判断拔罐多久拔一次体内湿气重的表现症状拔罐减肥的位置图拔罐图解拔罐后注意事项拔罐后多久才可以冼澡
