1	1	0	385	6	224	走路赚钱的软件排行榜走路赚钱app推荐大全[多图]2016年3月9日说到步步夺金,应该是走路赚钱软件一个标识了,毕竟是平台好医生全面打造的一个健步奖励计划,宣传的到位,掀起一阵走路赚钱的热潮,当然更是提高...网侠
2	2	0	385	230	448	走路赚钱的软件叫什么走路赚钱的app有哪些(下载地址)2016年3月11日最近不是朋友都在使用一款平安好医生推出的走路赚钱软件,这里小编就给大家带来相关的介绍及其下载。走路赚钱的软件叫什么小编这里给大家推...西西软件园
3	3	0	385	454	648	走路赚钱app有哪些?走路赚钱的软件介绍2016年3月11日以上就是小编为大家带来的走路赚钱app有哪些?走路赚钱的软件介绍。当然还有一些走路赚钱软件,这里就不一一介绍了。更多精彩APP请关注亿智...wap.yzmg.com
4	4	15	370	669	957.75	91%的人还搜了：花椒咕咚运动咕咚跑步跑步控苹果手机走路软件安卓走路软件记录每天走路的软件iphone走路软件走路赚钱的手机软件跑步软件
5	5	0	385	976.75	1172.75	【图】不知道有那些走路软件6个软件供你挑选_走路软件_伊秀美体...乐动力是一款运动辅助软件,你无需打开软件,它就能自动记录你每天的运动量。简单方便,让这款软件来辅助你锻炼吧。最有爱的跑步APP、健走计步器,Plank运动健身。国内唯...伊秀女性网
None	6	0	385	1178.75	1361.75	步行记录器步行记录器下载步行记录器手机版下载步行记录器手机版下载,手机软件步行记录器下载步行记录器步行记录器RuntasticPe...《步行记录器RuntasticPedometerPRO》是一款计步器,能够记录你步行的相关数据,自...3533手机世界游戏
None	7	0	385	1367.75	1526.75	走路更有趣|走路更有趣v3.11安卓版下载让这款计步器软件帮助你使走路和跑步变得更加有趣吧!StepsMania可以激发你对运动的积极性,让运动成为你日常生活的一部分,从而达到强身健体的作用。本软件支持后台运...非凡软件站
None	8	15	370	1547.75	1711.5	其他人还搜乐动力益动GPSRuntasticPRO悦跑圈
None	9	0	385	1735.5	1907.5	一起来减肥吧!将手机变成走路计步器APP太平洋电脑软件
None	10	0	385	1913.5	2084.5	这是什么软件?走路可以赚钱?_百度知道百度知道-2015年3月17日2921请问这个软件叫什么?我看过别人玩,也告诉过我,我就是忘记叫什么了,能告诉我吗?请问这个软件叫什么?我看过别人玩,也告诉过我,我就是忘记叫什么了,能告诉我吗?查看全文展开
None	11	0	385	2090.5	2273.5	给大家介绍一款走路赚钱的软件_苍山吧_百度贴吧这款软件叫平安好医生,有了它就可以边运动边挣钱了,哈哈,我今天赚了1.6,元盗墓笔记和张大佛爷、二月红一起去探秘矿洞墓穴!上三门、平三门、下三门,盗墓世家从何而来!...百度贴吧
None	12	0	385	2279.5	2451.5	安卓走路软件_手机走路软件_5577我机网走路软件走路被誉为21世纪最好的锻炼方法之一,不但因为它不受时间、空间的限制,而且行走速度可快可慢,从而达到不同的健身效果。当你想用走路的步数测定一个距离时,当...www.5577.com
None	13	0	0	0	0	
None	14	0	0	0	0	
