1	1	0	385	6	315	家常肉丝炒饼的做法_【图解】家常肉丝炒饼怎么做好吃_食尚小米猪里脊肉片片切丝。肉丝用、料酒、盐、水淀粉抓匀腌渍,窍门:加少许油拌匀,一会不粘锅。将烙饼切成丝儿。圆白菜切细丝,小辣椒切圈、香葱切末,蒜拍碎切末。豆芽洗净备用。豆果网
2	2	0	385	321	504	炒饼的做法大全_炒饼怎么做好吃【合集】炒饼的家常|简单做法大全...豆果美食提供炒饼的做法大全系列菜单和菜谱的做法,各种清晰美味菜式图片,丰富的家常食谱菜谱菜单大全可以让你轻轻松松做出美味可口的佳肴。炒饼的做法大全创建时间...豆果网
3	3	0	385	510	681	炒饼的做法的相关视频炒饼的做法炒面的做法炒凉粉做法09:32我家厨房2011：家常肉炒饼11033007:33历史悠久的张氏炒饼的做法04:55【小厨娘】超级无敌简单的素炒饼19:49尖椒炒饼的做法主食也疯狂01:33:47火腿油菜~红烧千张~猪排火锅~肉炒饼08:17好吃又好学家常炒饼的做法教程00:49豆角炒饼的做法_山西后生小吃培训Q171820073706:07韭菜虾仁炒饼的做法08:11健康新食代12299-2家常炒面05:49味蕾时光第2季西班牙海鲜炒面05:47木下养不起之追加了蛋黄酱和鸡蛋的泡菜炒面篇~16051005:47木下养不起之追加了蛋黄酱和鸡蛋的泡菜炒面篇~05:47【木下大胃王】最后还是辣到舌头颤抖的2.5kg诚意泡菜炒面+各种配菜02:58雪菜豆干肉丝炒面17302:58雪菜豆干肉丝炒面02:18私味食光第十九集［日式炒面］00:33四川凉粉_特色小吃凉粉_陕西凉粉的做法炒凉粉_凉粉的做法_川北凉粉_25:49食全食美12081405:42舌尖上的开封炒凉粉——沈天畅03:45炒凉粉的做法00:43怎样做凉粉_四川凉粉_特色小吃凉粉_陕西凉粉的做法炒凉粉_凉粉的做法_川北凉粉_04:18素食炒凉粉00:33四川凉粉_特色小吃凉粉_陕西凉粉的做法炒凉粉_凉粉的做法_川北凉粉_07:31我的私房菜'开封炒凉粉'一美食拍客小多，子非（河南郑州）
4	4	15	370	702	990.75	93%的人还搜了：炒面焖饼焖面豆芽炒饼的做法大全素炒饼炒饼的家常做法炒饼的饼怎么做豆芽炒饼的家常做法豆芽炒饼丝
5	5	0	385	1009.75	1280.75	【图文】炒饼的做法_炒饼的家常做法_炒饼怎么做好吃_做法步骤,视...准备食材烙饼切丝火腿肠切丝。鸡毛菜择洗干净备用。美食天下美食家
None	6	0	385	1286.75	1493.75	炒饼的家常做法_炒饼的做法大全_怎么做炒饼【心食谱】家常炒饼,肉丝炒饼,素炒饼,蛋饼皮与茼蒿的变身-汤炒饼,「RiTa小食堂」什锦鲜蔬炒饼,木须牛炒饼,蔬菜炒饼,什锦炒饼『牛头牌端午好香拌』,[矽谷美味人妻]5分钟什锦培根炒饼...心食谱
None	7	0	385	1499.75	1680.75	炒饼的做法1个回答-提问时间：2013-09-04原料:水、面粉、色拉油、椒盐、五香粉。快速烙饼的做法:1、将水慢慢倒入面粉中，用筷子搅拌均匀;(水量一般为面粉的一半左右，想让面硬点就少加点水，想让面软点就多加点水)2、将面粉和成光滑面团，最好做到盆光、面光、手光的“三光”政策，盖上盖或保鲜膜饧半个小时以上;(一般做饼最好多饧一会儿，最好饧两个小时以上，做的饼才会软)3、将饧好的面擀成薄片，均匀的涂抹一层色拉油和盐，也可根据个人口味加一点椒盐或五香粉;4、将面片360问答
None	8	15	370	1701.75	1895.75	其他人还搜卷心菜豆芽炒粉丝烙千层饼
None	9	0	385	1919.75	2094.75	炒饼简介：炒饼，汉族面食，北方地区主食的一种，多见于山西、河北、河南、北京一带。鸡翅饼片为陕西特色名菜，为一...概述菜品介绍做法营养价值
None	10	0	385	2100.75	2272.75	鸡蛋炒饼原料：主料:饼丝、鸡蛋、圆白菜。辅料:老抽、盐、白糖、葱姜蒜。做法：1、圆白菜切丝,鸡蛋放少许盐打散,葱姜蒜切片备用;2、锅中放少量油,油热后下入鸡蛋打散,炒熟后盛出备用;3、锅中放油,加热到七成热下入葱姜蒜片煸香,放入饼丝翻炒一分钟,放老抽上色,继续翻炒至上色均匀后放入圆白菜丝,翻炒均匀,放盐和糖调味;4、最后放入炒好的鸡蛋翻炒均匀即可出锅。5、补充:6、饼...美食天下
None	11	0	385	2278.75	2606.75	炒饼的做法,炒饼怎么做好吃,炒饼的家常做法_小培_好豆网五花肉切丝,豆芽洗净滤干水份备用。锅烧热,加少许油倒入五花肉翻炒炒至肉出油,倒入少许料酒、老抽、盐闷3分钟左右,盛出备用锅涮干净,烧热倒少许油倒入择好的豆芽,翻炒。用的是黄豆芽比较难熟,加了点水闷了几分钟好豆网
None	12	0	385	2612.75	2883.75	【图文】素炒饼的做法_素炒饼的家常做法_素炒饼怎么做好吃_做法...烙饼,圆白菜切丝,葱姜切末锅中倒适量油烧热,放葱姜丝炝锅放圆白菜煸炒,放点盐,糖,放生抽煸炒至菜变软,上色美食天下美食家
None	13	0	385	2889.75	3160.75	青椒西红柿炒饼的做法,青椒西红柿炒饼怎么做好吃,青椒西红柿炒饼...将西红柿、青椒和饼切成条,蒜拍一下切碎备用。锅热到油,油热下青椒。炒变色,加盐调味,盛出备用。重起油锅,下蒜和西红柿翻炒,加盐调味。好豆网
None	14	0	385	3166.75	3437.75	炒饼丝的做法,炒饼丝怎么做好吃,炒饼丝的家常做法_邮寄舂迗_好豆网尖椒不去籽切丝,胡萝卜切丝,火腿肠切条,葱蒜切片圆白菜切丝买的现成的饼丝热锅下油,油稍微多些更好吃,油热倒入火腿煎好豆网
None	15	0	0	0	0	
None	16	0	0	0	0	
