1	1	0	385	6	227	青岛职业技术学院2016年9月7日,青岛服务外包人才培训有限公司在青岛职业技术学院综合实训楼二楼西会议室进行公寓管理员招聘面试工作,现将面试成绩公示如下:面试.[2016-09-05][2016-07...内部网学院简介学院风光教学及辅助机构就业信息网通知公告人才引进招聘现任领导青岛职业技术学院
2	2	0	385	233	408	青岛职业技术学院简介：青岛职业技术学院是一所山东省主办，山东省、青岛市共管、以青岛市为主管的全日制普通高校。是国家示范高...历史沿革办学条件科研成就文化传统
3	3	0	385	414	693	青岛职业技术学院青岛职业技术学院香江路12801到这去0532-86951138北京
4	4	15	370	714	1002.75	92%的人还搜了：威海职业学院烟台职业学院山东商务职业学院山东外贸职业学院青岛职业技术学院群青岛职业技术学院网青岛职业技术学院女青岛职业技术学院分青岛职业技术学院qq青岛职业技术学院好
5	5	0	385	1021.75	1180.75	青岛港湾职业技术学院学院新闻College&Newsmore系部动态Depart&Newsmore缤纷校园Colorfulcampusmore媒体看港院Med&Newsmore实训基地信息公开培训办公室公共教学部...www.qdgw.com
None	6	0	385	1186.75	1367.75	青岛职业技术学院分数线1个回答-提问时间：2013-07-16你的分数有点悬啊。。。既然报了就安心等待吧。。。假如录取了你肯定不可能报考其他学校了。。其实这学校的会计还是很不错的。。。。假如录取不了你可以等到补录。再看看。、。360问答
None	7	0	385	1373.75	1556.75	青岛职业技术学院高考招生--高考志愿填报参考系统权威发布青岛职业技术学院2016年高考招生信息查询,内容包括2016年高考招生计划和招生简章查询、各省及高校历年录取分数线查询、分专业录取分数线查询,并提供2016年...中国教育在线高考填报
None	8	15	370	1577.75	1741.5	其他人还搜物流管理会计电算化齐鲁理工学院工程造价
None	9	0	385	1765.5	1937.5	青岛职业技术学院吧_百度贴吧青岛职业技术学院吧关注数:57688帖子数:1970072。◇本吧是为关心、关注、了解和希望了解青岛职业技术学院的网友们提供交流的平台。进入贴吧全吧搜索青岛职业技术...百度贴吧
None	10	0	385	1943.5	2105.59375	青岛职业技术学院_360图片（约7359张图片）查看更多
None	11	0	385	2111.59375	2294.59375	青岛职业技术学院_青岛职业技术学院怎么样_青岛职业技术学院分数...青岛职业技术学院是一所全日制普通高校,实行省、市双重领导,以青岛市为主的管理体制。学院于2000年10月在原青岛市职工大学的基础上成立,2002年4月与原青岛教育学院...出国留学网
None	12	0	385	2300.59375	2395.59375	青岛飞洋职业技术学院www.feiyangcollege.com
None	13	0	385	2401.59375	2560.59375	青岛求实职业技术学院关于举办青岛求实职业技术学院教学比赛结果公布|山东省教育厅等4部门关于做好2016年山东省职业教育活动周相关工作的通知2015青岛求实职业技术学院宣传片|2015-0...www.qdqs.com
None	14	0	385	2566.59375	2727.59375	青岛酒店管理职业技术学院校址:青岛市李沧区九水东路599号邮编:266100招生电话:0532-860515138605166686051512版权所有:青岛酒店管理职业技术学院鲁ICP备13027821号www.qchm.edu.cn
None	15	0	385	2733.59375	2908.59375	青岛飞洋职业技术学院简介：青岛飞洋职业技术学院是一所国家教育部备案，山东省政府批准的全日制普通高等院校，是国家教育部选定的"十...​历史沿革办学条件办学成就办学定位
None	16	0	0	0	0	
None	17	0	0	0	0	
