1	1	0	385	6	447	关于秋天的作文500字所有年级一年级二年级三年级四年级五年级六年级初中高中所有字数100字200字300字400字500字600字800字1000字《秋天》写景四年级-500字《秋天》写景三年级-500字《初一作文我爱秋天的景色》写景五年级-500字《秋天》写景三年级-500字《秋天》写景四年级-500字筛选无结果，试试其它条件吧筛选无结果，试试其它条件吧1/10
2	2	0	385	453	636	美丽的秋天作文500字2013年11月4日秋天的美丽作文500字秋天是美丽的季节。天气总是很晴朗,蔚蓝的天空中一丝云也没有,我常常抬头仰望,觉得老舍笔下草原的天空就是这样的…天是...万网
3	3	0	385	642	803	秋天的景色作文500字_秋天的景色500字_作文标题：秋天的景色正文：【第一篇】:秋天的景色秋天不像春天那样百花争艳,芳香怡人;也不像夏天那样有那么多的小生灵在歌唱;也没有冬天那么美丽。可是,它在我心中却是最美的。秋天虽然没有春天那么艳丽,可它有一种颜色是天下一绝的——红。枫叶只有在遇见秋天时才会脸红,远远望去,像朝霞一样红,把山都染红了。风吹来...m.ieduw.com
4	4	15	370	824	1112.75	90%的人还搜了：春天美丽的秋天爱在春天美丽的春天秋天的作文500字关于秋天的作文关于秋天的作文600字关于秋天的作文400字描写秋天的作文500字秋天的作文
5	5	0	385	1131.75	1380.75	关于秋天的作文500字左右(急求稿)真调皮!农民伯伯在忙着丰收呢,虽然他们汗流浃背,但脸上还不时挂着甜蜜的笑容。小草急忙地拖掉了绿衣裳,高兴地换上了黄衣服,得意扬扬地在秋风中炫耀......这就是秋天!可...秋天的作文500字1个回答秋天的树叶作文500...1个回答更多相关问题>
None	6	0	385	1386.75	1567.75	描写秋天景色的作文500字发贴时间-2013年9月3日描写秋天景色的作文500字:秋天的天空秋天,是个风高气爽的季节,是个丰收、丹桂飘香的季节,当然,也是个美丽的季节,描写秋天景色的作文。秋天的天空最美。早上,天空静悄悄...中国散文网
None	7	0	385	1573.75	1710.75	秋天写景作文500字标题：秋天写景作文500字正文：一年有四个季节,春、夏、秋、冬在这四个季节中我最喜欢的是秋天。秋天,凉风习习,这种清凉的感觉特别好!我喜欢秋天。虽然它没有春天的鸟语花香、没有夏天的烈日炎炎、没有冬天的白雪皑皑,而秋天景色宜人、天高云淡多么浪漫的景色啊!在秋天,我最喜欢的事情就是叫上好朋友在树下看本文来自免费...siteapp.oh100.com
None	8	0	385	1716.75	1899.75	秋天的作文300字_关于秋天的作文400字_500字_600字_200字_...秋天的作文栏目提供秋天的作文300字、秋天的作文400字、秋天的作文500字、关于秋天的作文600字等,欢迎踊跃投稿关于秋天的作文。欢迎来到作文网!关于秋天的作文文...中小学生作文网
None	9	0	385	1905.75	2096.75	关于初一秋天的作文500字急~~~~~360问答-2013年7月26日210夏姑娘匆匆地离开了,秋姑娘迈着轻盈的脚步走来了人间.天空秋高气爽,碧空如洗,蓝得使人心醉!徐徐的凉风,透明的薄物,高高的云天,摇曳的树影,都令人神清气爽!这就是秋天!当你漫步踏进果园时,一定会打开眼界,瞧,那滑溜溜的葡萄,就如一颗颗闪闪发光的星星;那红彤彤的苹果,仿佛是一个个滚烫的太阳;那黄澄澄的橘子,好象一个个小灯笼;那挂满枝头的龙眼,宛如一颗颗晶莹的珍珠;那张着大嘴巴的石榴,就像一个咿呀学语的小孩.真是美不胜收啊!这就是秋天!心事重重的秋风来了,金光闪闪的水稻,就像一位位婀娜多姿的少女,又好象一位位服务员,向人们招手示意!麦田此起彼伏,发出“沙沙”的响声,好象海浪在翻滚不息,又像乐队在演奏浪漫的小曲。金黄色的叶子,就像蝴蝶一样翩翩起舞,时而飞上天空,时而落到地上,真调皮!农民伯伯在忙着丰收呢,虽然他们汗流浃背,但脸上还不时挂着甜蜜的笑容。小草急忙地拖掉了绿衣裳,高兴地换上了黄衣服,得意扬扬地在秋风中炫耀.这就是秋天!可爱的小蚂蚁们,松鼠们都贪婪地收藏着食物,准备好过冬呢,想得挺周到的!青蛙、蛇他们更聪明呢,吃饱了后,好好地睡场大觉.这也是秋天!多么迷人的秋天呀,它象征着繁荣和富庶,意味着成熟和收获。……夏姑娘匆匆地离开了,秋姑娘迈着轻盈的脚步走来了人间.天空秋高气爽,碧空如洗,蓝得使人心醉!徐徐的凉风,透明的薄物,高高的云天,摇曳的树影,都令人神清气爽!这就是秋天!当你漫步踏进果园时,一定会打开眼界,瞧,那滑溜溜的葡萄,就如一颗颗闪闪发光的星星;那红彤彤的苹果,仿佛是一个个滚烫的太阳;那黄澄澄的橘子,好象一个个小灯笼;那挂满枝头的龙眼,宛如一颗颗晶莹的珍珠;那张着大嘴巴的石榴,就像一个咿呀学语的小孩.真是美不胜收啊!这就是秋天!心事重重的秋风来了,金光闪闪的水稻,就像一位位婀娜多姿的少女,又好象一位位服务员,向人们招手示意!麦田此起彼伏,发出“沙沙”的响声,好象海浪在翻滚不息,又像乐队在演奏浪漫的小曲。金黄色的叶子,就像蝴蝶一样翩翩起舞,时而飞上天空,时而落到地上,真调皮!农民伯伯在忙着丰收呢,虽然他们汗流浃背,但脸上还不时挂着甜蜜的笑容。小草急忙地拖掉了绿衣裳,高兴地换上了黄衣服,得意扬扬地在秋风中炫耀.这就是秋天!可爱的小蚂蚁们,松鼠们都贪婪地收藏着食物,准备好过冬呢,想得挺周到的!青蛙、蛇他们更聪明呢,吃饱了后,好好地睡场大觉.这也是秋天!多么迷人的秋天呀,它象征着繁荣和富庶,意味着成熟和收获。……查看全文展开
None	10	0	385	2102.75	2239.75	关于秋的作文500字标题：关于秋的作文500字正文：我爱那百花争艳的春天;我爱那浓荫如盖的夏季;我爱那粉妆玉砌的银冬;但我更爱那五彩斑斓的金秋。眼下已过中秋树上再也发现不了那又肥又大的蝉了风婆婆急急忙忙向这里赶人们换上了长衣抬头一看成群的大雁排着人字形向南方飞去……秋已经来临了。秋天是一个收获的季节菜市场里红的苹果、黄的香...siteapp.oh100.com
None	11	0	385	2245.75	2382.75	写秋的作文500字标题：写秋的作文500字正文：热情的夏姑娘走了,一身金黄的秋姑娘来了。秋姑娘把一篮子的神奇花粉撒在蓝蓝的天空上,天空立刻变得神气起来。千变万化的白云随风飘动,一群群大雁排成人字形从寒冷的北方飞向暖和的南方过冬。旁边还有一群小燕子在唧唧喳喳地叫,好像在说:“再见了,北方的小朋友们,明年春天再见了”秋姑娘把神...siteapp.oh100.com
None	12	0	385	2388.75	2571.75	关于秋天的作文500字2012年9月28日小编整理了关于秋天的作文500字,以供大家对秋的进一步品味!自古逢秋悲寂寥我言秋日胜春朝.我爱秋天的豪情万丈.走进秋日的果园满眼是硕果累累...zhongkao.juren.com
None	13	0	385	2577.75	2760.75	有关秋天的作文500字2011年11月10日有关秋天的作文500字我爱秋天,因为它美丽。在我的心中,秋天,就像是平易近人的老人,就像是金*的幸福,就像是看得见摸得着的美丽。人们说:果实渴...第一范文网
None	14	0	0	0	0	
None	15	0	0	0	0	
